service,goal,required_inputs,deliverables,first_tasks,next_upsell
Facebook Page Setup,"Make the page clear, trustworthy, and ready to receive leads.","Page link; offer; target customer; WhatsApp; logo","Bio; About; CTA; pinned post; services list; report","Audit clarity; rewrite bio; set CTA; prepare pinned post",Content Plan or CRM
Content Planning,"Create useful content that builds trust and generates messages.","Business type; products; customer pains; offers; media; competitors","Pillars; calendar; captions; scripts; stories; carousels","Define pillars; write hooks; draft posts; schedule",Monthly Support
Free Business Audit,"Diagnose and convert the lead into one clear next step.","Page/website link; current problem; lead source; follow-up method","Main problem; top 5 fixes; recommended package; next step","Check clarity; trust; CTA; content; sales flow","Page Setup, CRM, Website, or Content Plan"
Google Sheets CRM,"Stop losing customers, orders, payments, and follow-ups.","Lead sources; fields; sales stages; orders; payments; users","Leads; Customers; Orders; Follow-ups; Payments; Dashboard","Draw workflow; define fields; build tabs; add formulas",n8n Automation
n8n Automation,"Save time and reduce forgotten manual work.","Manual task; trigger; apps; fields; notifications; failure path","Workflow map; n8n workflow; tests; error path; docs","Define trigger; map fields; build; test; document",Monthly Support
Website / Landing Page,"Explain the offer and generate leads.","Name; services; offer; WhatsApp; proof; FAQ; domain","Hero; services; process; proof; FAQ; contact; SEO","Collect content; write copy; design; add CTA; test",CRM or Monthly Support
Technical Support,"Solve technical problems carefully with backup and documentation.","Issue; link; provider; access; start time; screenshots","Diagnosis; backup; fix summary; test result; prevention","Back up; diagnose; fix; test; explain",Monthly Technical Support
Monthly Business Support,"Continuously improve content, systems, website, automation, and reports.","Goals; systems; recurring tasks; reporting needs; budget","Monthly report; tasks; calendar; updates; recommendations","Review; plan; execute; monitor; report",Longer Retainer
